{
  "version": 1,
  "key": "custom-world-of-warcraft-high-detail",
  "name": "World of Warcraft - High Detail",
  "slots": [
    {
      "value": "forest",
      "display": "Forest",
      "labels": [
        "Forest",
        "tree",
        "grove",
        "canopy",
        "woodland",
        "thicket",
        "roots",
        "pine",
        "oak",
        "birch",
        "bark",
        "log",
        "branch",
        "stump",
        "moss",
        "trees"
      ],
      "threshold": 70,
      "enabled": true,
      "color": "#006400",
      "intensity": 4,
      "dutyPercent": 100,
      "cooldown": 14
    },
    {
      "value": "gunpowder",
      "display": "Gunpowder",
      "labels": [
        "Gunpowder",
        "fire",
        "dragon",
        "flame",
        "lava",
        "inferno",
        "torch",
        "ember",
        "campfire",
        "burning",
        "furnace",
        "chimney",
        "bonfire",
        "fireplace",
        "ash"
      ],
      "threshold": 70,
      "enabled": true,
      "color": "#A9A9A9",
      "intensity": 4,
      "dutyPercent": 100,
      "cooldown": 12
    },
    {
      "value": "cave",
      "display": "Cave",
      "labels": [
        "Cave",
        "dungeon",
        "raid",
        "mine",
        "cavern",
        "underground",
        "crypt",
        "tomb",
        "catacomb",
        "abyss",
        "tunnel",
        "grotto",
        "dark",
        "stalactite",
        "stalagmite"
      ],
      "threshold": 71,
      "enabled": true,
      "color": "#808080",
      "intensity": 4,
      "dutyPercent": 80,
      "cooldown": 14
    },
    {
      "value": "desert",
      "display": "Desert",
      "labels": [
        "Desert",
        "sand",
        "dune",
        "wasteland",
        "barren",
        "arid",
        "scorched",
        "cactus",
        "oasis",
        "dry",
        "sun",
        "heat",
        "mirage",
        "sandstorm",
        "canyon"
      ],
      "threshold": 72,
      "enabled": true,
      "color": "#EDC9AF",
      "intensity": 4,
      "dutyPercent": 100,
      "cooldown": 14
    },
    {
      "value": "temple",
      "display": "Temple",
      "labels": [
        "Temple",
        "cathedral",
        "shrine",
        "altar",
        "fortress",
        "citadel",
        "tower",
        "throne room",
        "church",
        "monastery",
        "chapel",
        "statue",
        "pillar",
        "dome",
        "stained glass"
      ],
      "threshold": 75,
      "enabled": true,
      "color": "#D4A574",
      "intensity": 4,
      "dutyPercent": 80,
      "cooldown": 12
    },
    {
      "value": "snow",
      "display": "Snow",
      "labels": [
        "Snow",
        "ice",
        "frost",
        "blizzard",
        "glacier",
        "frozen",
        "tundra",
        "snowflake",
        "icicle",
        "avalanche",
        "winter",
        "cold",
        "polar",
        "arctic",
        "sleet"
      ],
      "threshold": 75,
      "enabled": true,
      "color": "#F0F0FF",
      "intensity": 4,
      "dutyPercent": 60,
      "cooldown": 14
    },
    {
      "value": "energy",
      "display": "Energy",
      "labels": [
        "Energy",
        "magic",
        "arcane",
        "spell",
        "enchant",
        "rune",
        "aura",
        "glow",
        "artifact",
        "electric",
        "neon",
        "power",
        "laser",
        "plasma"
      ],
      "threshold": 75,
      "enabled": true,
      "color": "#00FF00",
      "intensity": 4,
      "dutyPercent": 80,
      "cooldown": 10
    },
    {
      "value": "grass",
      "display": "Grass",
      "labels": [
        "Grass",
        "meadow",
        "field",
        "plain",
        "fern",
        "moss",
        "vine",
        "clover",
        "lawn",
        "pasture",
        "hedge",
        "shrub",
        "bush",
        "prairie",
        "steppe",
        "park"
      ],
      "threshold": 70,
      "enabled": true,
      "color": "#7CFC00",
      "intensity": 4,
      "dutyPercent": 80,
      "cooldown": 14
    },
    {
      "value": "sea",
      "display": "Sea",
      "labels": [
        "Sea",
        "ocean",
        "harbor",
        "ship",
        "shore",
        "coast",
        "wave",
        "reef",
        "tide",
        "beach",
        "island",
        "boat",
        "pier",
        "dock",
        "coral"
      ],
      "threshold": 75,
      "enabled": true,
      "color": "#0078FF",
      "intensity": 4,
      "dutyPercent": 80,
      "cooldown": 14
    },
    {
      "value": "leather",
      "display": "Leather",
      "labels": [
        "Leather",
        "armor",
        "saddle",
        "mount",
        "harness",
        "belt",
        "gauntlet",
        "boots",
        "quiver",
        "scabbard",
        "jacket",
        "hide",
        "strap",
        "holster",
        "vest"
      ],
      "threshold": 75,
      "enabled": true,
      "color": "#6D4C41",
      "intensity": 4,
      "dutyPercent": 60,
      "cooldown": 10
    }
  ]
}