{
  "version": 1,
  "key": "custom-minecraft-high-detail",
  "name": "Minecraft - High Detail",
  "slots": [
    {
      "value": "forest",
      "display": "Forest",
      "labels": [
        "forest",
        "tree",
        "woods",
        "oak tree",
        "birch tree",
        "spruce tree",
        "jungle",
        "taiga",
        "dark forest",
        "log",
        "sapling"
      ],
      "threshold": 75,
      "enabled": true,
      "color": "#006400",
      "intensity": 3,
      "dutyPercent": 100,
      "cooldown": 8
    },
    {
      "value": "snow",
      "display": "Snow",
      "labels": [
        "snow",
        "snowy biome",
        "ice",
        "snow block",
        "snowy plains",
        "frozen ocean",
        "ice spikes",
        "powder snow",
        "igloo",
        "snowy taiga"
      ],
      "threshold": 75,
      "enabled": true,
      "color": "#F0F0FF",
      "intensity": 3,
      "dutyPercent": 60,
      "cooldown": 11
    },
    {
      "value": "grass",
      "display": "Grass",
      "labels": [
        "grass",
        "plains",
        "meadow",
        "grass block",
        "tall grass",
        "savanna",
        "sunflower plains",
        "green field",
        "pasture"
      ],
      "threshold": 81,
      "enabled": true,
      "color": "#7CFC00",
      "intensity": 3,
      "dutyPercent": 80,
      "cooldown": 10
    },
    {
      "value": "flowers",
      "display": "Flowers",
      "labels": [
        "flowers",
        "poppy",
        "flower field",
        "dandelion",
        "rose",
        "tulip",
        "sunflower",
        "lilac",
        "flower forest",
        "azalea",
        "cherry blossom"
      ],
      "threshold": 75,
      "enabled": true,
      "color": "#BC50F7",
      "intensity": 3,
      "dutyPercent": 60,
      "cooldown": 16
    },
    {
      "value": "dirt",
      "display": "Dirt",
      "labels": [
        "dirt",
        "dirt block",
        "mud",
        "coarse dirt",
        "podzol",
        "rooted dirt",
        "farmland",
        "soil",
        "path block",
        "mycelium"
      ],
      "threshold": 83,
      "enabled": true,
      "color": "#9D714D",
      "intensity": 3,
      "dutyPercent": 100,
      "cooldown": 8
    },
    {
      "value": "hay",
      "display": "Hay",
      "labels": [
        "hay",
        "hay bale",
        "wheat",
        "wheat field",
        "wheat crop",
        "straw",
        "barn",
        "village farm",
        "haystack"
      ],
      "threshold": 75,
      "enabled": true,
      "color": "#FFD700",
      "intensity": 3,
      "dutyPercent": 100,
      "cooldown": 8
    },
    {
      "value": "cave",
      "display": "Cave",
      "labels": [
        "cave",
        "stone",
        "cobblestone",
        "deepslate",
        "dripstone cave",
        "lush cave",
        "mineshaft",
        "ravine",
        "underground",
        "tunnel",
        "ore",
        "granite",
        "andesite",
        "diorite"
      ],
      "threshold": 81,
      "enabled": true,
      "color": "#616161",
      "intensity": 3,
      "dutyPercent": 100,
      "cooldown": 8
    },
    {
      "value": "sea",
      "display": "Sea",
      "labels": [
        "sea",
        "ocean",
        "water",
        "river",
        "lake",
        "beach",
        "deep ocean",
        "warm ocean",
        "coral reef",
        "shipwreck",
        "ocean monument"
      ],
      "threshold": 75,
      "enabled": true,
      "color": "#0078FF",
      "intensity": 3,
      "dutyPercent": 80,
      "cooldown": 8
    },
    {
      "value": "leaves",
      "display": "Leaves",
      "labels": [
        "leaves",
        "autumn leaves",
        "brown leaves",
        "oak leaves",
        "birch leaves",
        "jungle leaves",
        "spruce leaves",
        "foliage",
        "bush",
        "vines"
      ],
      "threshold": 75,
      "enabled": true,
      "color": "#FF4500",
      "intensity": 3,
      "dutyPercent": 60,
      "cooldown": 8
    },
    {
      "value": "smoke",
      "display": "Smoke",
      "labels": [
        "smoke",
        "fire",
        "lava",
        "desert",
        "nether",
        "netherrack",
        "soul sand",
        "basalt delta",
        "campfire",
        "furnace",
        "explosion",
        "tnt",
        "blaze",
        "ghast"
      ],
      "threshold": 80,
      "enabled": true,
      "color": "#F50000",
      "intensity": 3,
      "dutyPercent": 100,
      "cooldown": 8
    }
  ]
}