{
  "version": 1,
  "key": "custom-gta-5",
  "name": "GTA 5",
  "slots": [
    {
      "value": "brakes",
      "display": "Brakes",
      "labels": [
        "Brakes",
        "tire",
        "road",
        "skid",
        "drift",
        "burnout",
        "wheel",
        "asphalt",
        "highway",
        "freeway",
        "brake",
        "rubber",
        "skid mark",
        "car",
        "racing",
        "tread",
        "pavement",
        "street",
        "intersection",
        "traffic light",
        "lane",
        "curb",
        "road marking",
        "speed bump",
        "parking lot",
        "overpass"
      ],
      "threshold": 75,
      "enabled": true,
      "color": "#A9A9A9",
      "intensity": 5,
      "dutyPercent": 80,
      "cooldown": 10
    },
    {
      "value": "new-car",
      "display": "New Car",
      "labels": [
        "New Car",
        "car",
        "vehicle",
        "sports car",
        "supercar",
        "garage",
        "dashboard",
        "steering wheel",
        "convertible",
        "sedan",
        "car interior",
        "seat",
        "windshield",
        "rearview mirror",
        "gear shift",
        "speedometer",
        "headlight",
        "bumper",
        "hood",
        "exhaust pipe",
        "door handle",
        "trunk",
        "coupe",
        "SUV",
        "pickup truck",
        "motorcycle"
      ],
      "threshold": 75,
      "enabled": true,
      "color": "#C0C0C0",
      "intensity": 5,
      "dutyPercent": 60,
      "cooldown": 30
    },
    {
      "value": "smoke",
      "display": "Smoke",
      "labels": [
        "Smoke",
        "exhaust",
        "fire",
        "explosion",
        "flame",
        "wreck",
        "burning car",
        "smoke stack",
        "car crash",
        "burning",
        "charred",
        "debris",
        "gas station",
        "helicopter",
        "plane crash",
        "grenade",
        "rocket launcher",
        "soot",
        "smoldering",
        "fire truck",
        "ember",
        "cinder",
        "blaze",
        "arson",
        "inferno"
      ],
      "threshold": 75,
      "enabled": true,
      "color": "#808080",
      "intensity": 5,
      "dutyPercent": 100,
      "cooldown": 12
    },
    {
      "value": "leather",
      "display": "Leather",
      "labels": [
        "Leather",
        "seat",
        "jacket",
        "couch",
        "briefcase",
        "wallet",
        "belt",
        "holster",
        "interior",
        "luxury",
        "car seat",
        "vest",
        "duffle bag",
        "gun case",
        "motorcycle seat",
        "gloves",
        "boots",
        "strap",
        "handbag",
        "luggage",
        "office chair",
        "sofa",
        "armrest",
        "backpack",
        "wristband"
      ],
      "threshold": 75,
      "enabled": true,
      "color": "#8B4513",
      "intensity": 6,
      "dutyPercent": 60,
      "cooldown": 10
    },
    {
      "value": "gunpowder",
      "display": "Gunpowder",
      "labels": [
        "Gunpowder",
        "gun",
        "pistol",
        "rifle",
        "shotgun",
        "ammo",
        "bullet",
        "weapon",
        "shooting",
        "reload",
        "muzzle flash",
        "sniper",
        "magazine",
        "crosshair",
        "scope",
        "barrel",
        "trigger",
        "submachine gun",
        "assault rifle",
        "firearm",
        "ammunition box",
        "cartridge",
        "silencer",
        "iron sight",
        "weapon rack",
        "heist"
      ],
      "threshold": 75,
      "enabled": true,
      "color": "#696969",
      "intensity": 5,
      "dutyPercent": 100,
      "cooldown": 10
    },
    {
      "value": "rain",
      "display": "Rain",
      "labels": [
        "Rain",
        "puddle",
        "storm",
        "wet road",
        "thunder",
        "flood",
        "drizzle",
        "gutter",
        "splash",
        "downpour",
        "neon reflection",
        "wet freeway",
        "storm drain",
        "overpass",
        "spray",
        "lightning",
        "wet pavement",
        "rain drops",
        "cloudy sky",
        "slippery road",
        "windshield wiper",
        "water runoff",
        "monsoon",
        "damp street",
        "foggy"
      ],
      "threshold": 75,
      "enabled": true,
      "color": "#B0E0E6",
      "intensity": 5,
      "dutyPercent": 100,
      "cooldown": 12
    },
    {
      "value": "desert",
      "display": "Desert",
      "labels": [
        "Desert",
        "sand",
        "cactus",
        "canyon",
        "dusty road",
        "dry lake",
        "wasteland",
        "mesa",
        "dirt road",
        "quarry",
        "trailer park",
        "airstrip",
        "off-road",
        "barren",
        "arid",
        "rocky terrain",
        "gravel path",
        "sun baked",
        "tumbleweed",
        "abandoned building",
        "dirt trail",
        "dry brush",
        "scrubland",
        "rusty car",
        "desolate"
      ],
      "threshold": 75,
      "enabled": true,
      "color": "#EDC9AF",
      "intensity": 5,
      "dutyPercent": 100,
      "cooldown": 14
    },
    {
      "value": "perfume",
      "display": "Perfume",
      "labels": [
        "Perfume",
        "club",
        "nightclub",
        "strip club",
        "party",
        "cologne",
        "lounge",
        "bar",
        "casino",
        "fragrance",
        "VIP lounge",
        "penthouse",
        "dance floor",
        "cocktail",
        "disco ball",
        "DJ booth",
        "neon sign",
        "velvet rope",
        "champagne",
        "rooftop bar",
        "pool party",
        "limousine",
        "red carpet",
        "mansion",
        "luxury suite"
      ],
      "threshold": 75,
      "enabled": true,
      "color": "#FF1493",
      "intensity": 5,
      "dutyPercent": 100,
      "cooldown": 10
    },
    {
      "value": "coffee",
      "display": "Coffee",
      "labels": [
        "Coffee",
        "diner",
        "café",
        "restaurant",
        "fast food",
        "donut shop",
        "drive-thru",
        "counter",
        "mug",
        "breakfast",
        "food stand",
        "burger joint",
        "taco stand",
        "convenience store",
        "coffee cup",
        "bakery",
        "food truck",
        "takeout",
        "menu board",
        "cash register",
        "deli",
        "pizza shop",
        "ice cream parlor",
        "hot dog cart",
        "streetside café"
      ],
      "threshold": 75,
      "enabled": true,
      "color": "#6F4E37",
      "intensity": 5,
      "dutyPercent": 100,
      "cooldown": 10
    },
    {
      "value": "sea",
      "display": "Sea",
      "labels": [
        "Sea",
        "beach",
        "pier",
        "ocean",
        "harbor",
        "yacht",
        "marina",
        "wave",
        "surfboard",
        "coast",
        "jet ski",
        "submarine",
        "boardwalk",
        "dock",
        "fishing boat",
        "lighthouse",
        "palm tree",
        "sand",
        "seagull",
        "lifeguard tower",
        "sailboat",
        "speedboat",
        "shoreline",
        "tide",
        "reef"
      ],
      "threshold": 75,
      "enabled": true,
      "color": "#0078FF",
      "intensity": 6,
      "dutyPercent": 80,
      "cooldown": 14
    }
  ]
}
