{
  "version": 1,
  "key": "custom-fortnite-high-detail",
  "name": "Fortnite - High Detail",
  "slots": [
    {
      "value": "grass",
      "display": "Grass",
      "labels": [
        "grass",
        "meadow",
        "lawn",
        "field",
        "turf",
        "hay",
        "weeds",
        "clover",
        "shrub",
        "hedge",
        "straw",
        "thicket",
        "moss patch",
        "wild grass"
      ],
      "threshold": 70,
      "enabled": true,
      "color": "#28D90E",
      "intensity": 4,
      "dutyPercent": 100,
      "cooldown": 13
    },
    {
      "value": "forest",
      "display": "Forest",
      "labels": [
        "forest",
        "tree",
        "bush",
        "leaves",
        "pine",
        "log",
        "moss",
        "branch",
        "trunk",
        "woodland",
        "fern",
        "stump",
        "bark",
        "oak",
        "forest floor",
        "twig",
        "root",
        "plants",
        "wood"
      ],
      "threshold": 73,
      "enabled": true,
      "color": "#006308",
      "intensity": 4,
      "dutyPercent": 100,
      "cooldown": 13
    },
    {
      "value": "dirt",
      "display": "Dirt",
      "labels": [
        "dirt",
        "mud",
        "dust",
        "soil",
        "path",
        "rock",
        "gravel",
        "clay",
        "ground",
        "terrain",
        "trail",
        "dust cloud",
        "dirt road",
        "sand",
        "pebble",
        "boulder",
        "quarry",
        "cliff",
        "excavation",
        "crater",
        "cave"
      ],
      "threshold": 70,
      "enabled": true,
      "color": "#8B6914",
      "intensity": 6,
      "dutyPercent": 80,
      "cooldown": 7
    },
    {
      "value": "smoke",
      "display": "Smoke",
      "labels": [
        "smoke",
        "fire",
        "ash",
        "flame",
        "explosion",
        "smoke cloud",
        "burning",
        "ember",
        "soot",
        "campfire",
        "smokestack",
        "gunpowder",
        "wreckage",
        "blast",
        "flare",
        "smog",
        "blue fire"
      ],
      "threshold": 70,
      "enabled": true,
      "color": "#EDC9AF",
      "intensity": 6,
      "dutyPercent": 100,
      "cooldown": 7
    },
    {
      "value": "sea",
      "display": "Sea",
      "labels": [
        "sea",
        "ocean",
        "wave",
        "beach",
        "pier",
        "lake",
        "river",
        "coast",
        "boat",
        "buoy",
        "cliffside",
        "saltwater",
        "current",
        "reef",
        "strand",
        "iced lake"
      ],
      "threshold": 70,
      "enabled": true,
      "color": "#0078FF",
      "intensity": 6,
      "dutyPercent": 100,
      "cooldown": 8
    },
    {
      "value": "fuel",
      "display": "Fuel",
      "labels": [
        "fuel",
        "gasoline",
        "tank",
        "oil",
        "gas station",
        "canister",
        "barrel",
        "refinery",
        "pipeline",
        "fuel tank",
        "spill",
        "fumes",
        "engine",
        "exhaust",
        "drum",
        "generator",
        "bus",
        "car"
      ],
      "threshold": 72,
      "enabled": true,
      "color": "#FF7700",
      "intensity": 6,
      "dutyPercent": 100,
      "cooldown": 7
    },
    {
      "value": "rain",
      "display": "Rain",
      "labels": [
        "rain",
        "puddle",
        "cloud",
        "storm",
        "lightning",
        "wet",
        "drizzle",
        "thunder",
        "downpour",
        "mist",
        "fog",
        "raindrop",
        "overcast",
        "umbrella",
        "flood",
        "damp",
        "humidity",
        "splash",
        "gray sky",
        "wind"
      ],
      "threshold": 73,
      "enabled": true,
      "color": "#4FC3F7",
      "intensity": 7,
      "dutyPercent": 100,
      "cooldown": 8
    },
    {
      "value": "victory",
      "display": "Victory",
      "labels": [
        "victory",
        "trophy",
        "confetti",
        "crown",
        "fireworks",
        "podium",
        "banner",
        "celebration",
        "glow",
        "star",
        "spotlight",
        "gold",
        "applause",
        "winner",
        "ceremony",
        "flag",
        "glory",
        "healing",
        "level",
        "EP"
      ],
      "threshold": 72,
      "enabled": true,
      "color": "#F4D9A5",
      "intensity": 8,
      "dutyPercent": 100,
      "cooldown": 10
    },
    {
      "value": "snow",
      "display": "Snow",
      "labels": [
        "snow",
        "frost",
        "snowflake",
        "icicle",
        "winter",
        "snowdrift",
        "glacier",
        "blizzard",
        "snowman",
        "snowbank",
        "white ground",
        "snow cap",
        "tundra",
        "permafrost"
      ],
      "threshold": 69,
      "enabled": true,
      "color": "#6BA8FF",
      "intensity": 7,
      "dutyPercent": 80,
      "cooldown": 8
    },
    {
      "value": "farm",
      "display": "Farm",
      "labels": [
        "farm",
        "barn",
        "crop",
        "wheat",
        "silo",
        "fence",
        "hay",
        "tractor",
        "cornfield",
        "farmhouse",
        "haystack",
        "pasture",
        "scarecrow",
        "plow",
        "farmland",
        "pumpkin",
        "chest",
        "golden chest",
        "field"
      ],
      "threshold": 71,
      "enabled": true,
      "color": "#8A6F35",
      "intensity": 7,
      "dutyPercent": 100,
      "cooldown": 8
    }
  ]
}