{
  "version": 1,
  "key": "custom-dota-2",
  "name": "Dota 2",
  "slots": [
    {
      "value": "forest",
      "display": "Forest",
      "labels": [
        "Forest",
        "tree",
        "jungle",
        "radiant",
        "dire",
        "woodland",
        "canopy",
        "grove",
        "ancient tree",
        "roots",
        "pine",
        "oak",
        "birch",
        "thicket",
        "bark"
      ],
      "threshold": 75,
      "enabled": true,
      "color": "#006400",
      "intensity": 5,
      "dutyPercent": 100,
      "cooldown": 14
    },
    {
      "value": "smoke",
      "display": "Smoke",
      "labels": [
        "Smoke",
        "fire",
        "flame",
        "infernal",
        "lava",
        "ember",
        "torch",
        "pyre",
        "blaze",
        "magma",
        "campfire",
        "burning",
        "furnace",
        "chimney",
        "bonfire"
      ],
      "threshold": 75,
      "enabled": true,
      "color": "#808080",
      "intensity": 5,
      "dutyPercent": 100,
      "cooldown": 12
    },
    {
      "value": "dirt",
      "display": "Dirt",
      "labels": [
        "Dirt",
        "path",
        "mud",
        "ground",
        "terrain",
        "rubble",
        "earth",
        "gravel",
        "clay",
        "soil",
        "dust",
        "excavation",
        "pit",
        "trench",
        "footprint"
      ],
      "threshold": 75,
      "enabled": true,
      "color": "#8B6914",
      "intensity": 5,
      "dutyPercent": 90,
      "cooldown": 14
    },
    {
      "value": "desert",
      "display": "Desert",
      "labels": [
        "Desert",
        "sand",
        "dune",
        "wasteland",
        "barren",
        "arid",
        "scorched",
        "canyon",
        "dry",
        "mesa",
        "cactus",
        "oasis",
        "sun",
        "heat",
        "mirage"
      ],
      "threshold": 75,
      "enabled": true,
      "color": "#EDC9AF",
      "intensity": 5,
      "dutyPercent": 100,
      "cooldown": 14
    },
    {
      "value": "leaves",
      "display": "Leaves",
      "labels": [
        "Leaves",
        "grass",
        "lane",
        "field",
        "creep",
        "fern",
        "moss",
        "vine",
        "bush",
        "foliage",
        "autumn",
        "fall",
        "canopy",
        "deciduous",
        "maple"
      ],
      "threshold": 75,
      "enabled": true,
      "color": "#7CFC00",
      "intensity": 5,
      "dutyPercent": 60,
      "cooldown": 10
    },
    {
      "value": "rain",
      "display": "Rain",
      "labels": [
        "Rain",
        "river",
        "waterfall",
        "stream",
        "lake",
        "pond",
        "rapids",
        "wet",
        "mist",
        "fog",
        "umbrella",
        "puddle",
        "drizzle",
        "storm",
        "thunder"
      ],
      "threshold": 75,
      "enabled": true,
      "color": "#B0E0E6",
      "intensity": 5,
      "dutyPercent": 100,
      "cooldown": 12
    },
    {
      "value": "temple",
      "display": "Temple",
      "labels": [
        "Temple",
        "tower",
        "ancient",
        "shrine",
        "monument",
        "altar",
        "ruin",
        "fortress",
        "citadel",
        "barracks",
        "cathedral",
        "church",
        "monastery",
        "chapel",
        "statue"
      ],
      "threshold": 75,
      "enabled": true,
      "color": "#DAA520",
      "intensity": 5,
      "dutyPercent": 80,
      "cooldown": 12
    },
    {
      "value": "flowers",
      "display": "Flowers",
      "labels": [
        "Flowers",
        "garden",
        "bloom",
        "enchanted",
        "petal",
        "blossom",
        "orchid",
        "lotus",
        "rose",
        "herb",
        "flower",
        "tulip",
        "lily",
        "daisy",
        "sunflower"
      ],
      "threshold": 75,
      "enabled": true,
      "color": "#FF69B4",
      "intensity": 5,
      "dutyPercent": 60,
      "cooldown": 16
    },
    {
      "value": "energy",
      "display": "Energy",
      "labels": [
        "Energy",
        "magic",
        "mana",
        "arcane",
        "spell",
        "rune",
        "enchant",
        "glow",
        "aura",
        "artifact",
        "electric",
        "neon",
        "power",
        "laser",
        "plasma"
      ],
      "threshold": 75,
      "enabled": true,
      "color": "#00FF00",
      "intensity": 7,
      "dutyPercent": 80,
      "cooldown": 10
    },
    {
      "value": "victory",
      "display": "Victory",
      "labels": [
        "Victory",
        "throne",
        "aegis",
        "ancient destroyed",
        "champion",
        "mega kill",
        "rampage",
        "godlike",
        "glory",
        "triumph",
        "trophy",
        "medal",
        "podium",
        "celebration",
        "fireworks"
      ],
      "threshold": 75,
      "enabled": true,
      "color": "#FFD700",
      "intensity": 6,
      "dutyPercent": 100,
      "cooldown": 8
    }
  ]
}
