{
  "version": 1,
  "key": "custom-call-of-duty",
  "name": "Call of Duty",
  "slots": [
    {
      "value": "gunpowder",
      "display": "Gunpowder",
      "labels": [
        "Gunpowder",
        "gun",
        "rifle",
        "assault rifle",
        "sniper",
        "pistol",
        "shotgun",
        "bullet",
        "weapon",
        "shooting",
        "reload",
        "ammo",
        "muzzle flash",
        "magazine",
        "crosshair"
      ],
      "threshold": 75,
      "enabled": true,
      "color": "#696969",
      "intensity": 8,
      "dutyPercent": 100,
      "cooldown": 10
    },
    {
      "value": "smoke",
      "display": "Smoke",
      "labels": [
        "Smoke",
        "grenade",
        "fire",
        "explosion",
        "napalm",
        "molotov",
        "flash",
        "thermite",
        "mortar",
        "airstrike",
        "campfire",
        "flame",
        "torch",
        "burning",
        "ember"
      ],
      "threshold": 75,
      "enabled": true,
      "color": "#808080",
      "intensity": 7,
      "dutyPercent": 100,
      "cooldown": 12
    },
    {
      "value": "dirt",
      "display": "Dirt",
      "labels": [
        "Dirt",
        "trench",
        "foxhole",
        "bunker",
        "rubble",
        "gravel",
        "debris",
        "crater",
        "ground",
        "terrain",
        "mud",
        "soil",
        "dust",
        "earth",
        "clay"
      ],
      "threshold": 75,
      "enabled": true,
      "color": "#8B6914",
      "intensity": 6,
      "dutyPercent": 90,
      "cooldown": 14
    },
    {
      "value": "leather",
      "display": "Leather",
      "labels": [
        "Leather",
        "boots",
        "vest",
        "gloves",
        "belt",
        "holster",
        "strap",
        "tactical gear",
        "backpack",
        "harness",
        "armor",
        "saddle",
        "jacket",
        "hide",
        "scabbard"
      ],
      "threshold": 75,
      "enabled": true,
      "color": "#8B4513",
      "intensity": 5,
      "dutyPercent": 60,
      "cooldown": 10
    },
    {
      "value": "leaves",
      "display": "Leaves",
      "labels": [
        "Leaves",
        "grass",
        "prone",
        "ghillie",
        "camouflage",
        "brush",
        "hedge",
        "fern",
        "moss",
        "weeds",
        "autumn",
        "fall",
        "foliage",
        "canopy",
        "deciduous"
      ],
      "threshold": 75,
      "enabled": true,
      "color": "#7CFC00",
      "intensity": 5,
      "dutyPercent": 60,
      "cooldown": 10
    },
    {
      "value": "rain",
      "display": "Rain",
      "labels": [
        "Rain",
        "mud",
        "storm",
        "trench",
        "puddle",
        "wet",
        "thunder",
        "monsoon",
        "downpour",
        "drizzle",
        "umbrella",
        "cloud",
        "rainbow",
        "shower",
        "lightning"
      ],
      "threshold": 75,
      "enabled": true,
      "color": "#B0E0E6",
      "intensity": 5,
      "dutyPercent": 100,
      "cooldown": 12
    },
    {
      "value": "health",
      "display": "Health",
      "labels": [
        "Health",
        "medkit",
        "syringe",
        "bandage",
        "first aid",
        "stim",
        "heal",
        "revive",
        "health pack",
        "recovery",
        "potion",
        "medicine",
        "hospital",
        "cure",
        "heart"
      ],
      "threshold": 75,
      "enabled": true,
      "color": "#00CED1",
      "intensity": 6,
      "dutyPercent": 100,
      "cooldown": 8
    },
    {
      "value": "desert",
      "display": "Desert",
      "labels": [
        "Desert",
        "sand",
        "ruins",
        "bunker",
        "outpost",
        "dune",
        "dry",
        "wasteland",
        "sandstorm",
        "arid",
        "cactus",
        "oasis",
        "barren",
        "scorched",
        "sun"
      ],
      "threshold": 75,
      "enabled": true,
      "color": "#EDC9AF",
      "intensity": 6,
      "dutyPercent": 100,
      "cooldown": 14
    },
    {
      "value": "forest",
      "display": "Forest",
      "labels": [
        "Forest",
        "tree",
        "bush",
        "jungle",
        "canopy",
        "thicket",
        "woodland",
        "pine",
        "undergrowth",
        "foliage",
        "oak",
        "birch",
        "grove",
        "roots",
        "bark"
      ],
      "threshold": 75,
      "enabled": true,
      "color": "#006400",
      "intensity": 5,
      "dutyPercent": 100,
      "cooldown": 14
    },
    {
      "value": "victory",
      "display": "Victory",
      "labels": [
        "Victory",
        "medal",
        "rank up",
        "killstreak",
        "nuke",
        "champion",
        "trophy",
        "dog tags",
        "prestige",
        "podium",
        "celebration",
        "fireworks",
        "confetti",
        "crown",
        "gold"
      ],
      "threshold": 75,
      "enabled": true,
      "color": "#FFD700",
      "intensity": 8,
      "dutyPercent": 100,
      "cooldown": 8
    }
  ]
}
