{
  "version": 1,
  "key": "custom-counter-strike-2",
  "name": "Counter-Strike 2",
  "slots": [
    {
      "value": "gunpowder",
      "display": "Gunpowder",
      "labels": [
        "Gunpowder",
        "gun",
        "rifle",
        "pistol",
        "deagle",
        "glock",
        "shotgun",
        "bullet",
        "weapon",
        "shooting",
        "reload",
        "ammo",
        "muzzle flash",
        "sniper",
        "magazine"
      ],
      "threshold": 75,
      "enabled": true,
      "color": "#696969",
      "intensity": 8,
      "dutyPercent": 100,
      "cooldown": 10
    },
    {
      "value": "smoke",
      "display": "Smoke",
      "labels": [
        "Smoke",
        "fire",
        "flashbang",
        "molotov",
        "incendiary",
        "decoy",
        "burning",
        "defuse smoke",
        "flash",
        "campfire",
        "flame",
        "torch",
        "ember",
        "furnace",
        "chimney"
      ],
      "threshold": 75,
      "enabled": true,
      "color": "#808080",
      "intensity": 7,
      "dutyPercent": 100,
      "cooldown": 12
    },
    {
      "value": "dirt",
      "display": "Dirt",
      "labels": [
        "Dirt",
        "ground",
        "gravel",
        "rubble",
        "debris",
        "dust",
        "concrete",
        "foundation",
        "stone",
        "cobble",
        "mud",
        "soil",
        "earth",
        "clay",
        "terrain"
      ],
      "threshold": 75,
      "enabled": true,
      "color": "#8B6914",
      "intensity": 6,
      "dutyPercent": 90,
      "cooldown": 14
    },
    {
      "value": "desert",
      "display": "Desert",
      "labels": [
        "Desert",
        "dust",
        "sand",
        "dust2",
        "mirage",
        "dry",
        "arid",
        "canyon",
        "scorched",
        "barren",
        "dune",
        "cactus",
        "oasis",
        "wasteland",
        "sun"
      ],
      "threshold": 75,
      "enabled": true,
      "color": "#EDC9AF",
      "intensity": 6,
      "dutyPercent": 100,
      "cooldown": 14
    },
    {
      "value": "cave",
      "display": "Cave",
      "labels": [
        "Cave",
        "tunnel",
        "sewer",
        "vent",
        "underground",
        "passage",
        "corridor",
        "duct",
        "bunker",
        "catacomb",
        "dungeon",
        "mine",
        "cavern",
        "grotto",
        "dark"
      ],
      "threshold": 75,
      "enabled": true,
      "color": "#E1E1E1",
      "intensity": 5,
      "dutyPercent": 100,
      "cooldown": 14
    },
    {
      "value": "rain",
      "display": "Rain",
      "labels": [
        "Rain",
        "puddle",
        "wet",
        "overpass",
        "storm",
        "drain",
        "gutter",
        "splash",
        "drizzle",
        "mist",
        "umbrella",
        "thunder",
        "cloud",
        "rainbow",
        "shower"
      ],
      "threshold": 75,
      "enabled": true,
      "color": "#B0E0E6",
      "intensity": 5,
      "dutyPercent": 100,
      "cooldown": 12
    },
    {
      "value": "health",
      "display": "Health",
      "labels": [
        "Health",
        "medkit",
        "health shot",
        "heal",
        "recovery",
        "armor repair",
        "bandage",
        "regen",
        "restore",
        "survival",
        "potion",
        "medicine",
        "hospital",
        "cure",
        "heart"
      ],
      "threshold": 75,
      "enabled": true,
      "color": "#00CED1",
      "intensity": 6,
      "dutyPercent": 100,
      "cooldown": 8
    },
    {
      "value": "leather",
      "display": "Leather",
      "labels": [
        "Leather",
        "vest",
        "kevlar",
        "helmet",
        "gloves",
        "holster",
        "belt",
        "boots",
        "strap",
        "gear",
        "armor",
        "saddle",
        "jacket",
        "hide",
        "harness"
      ],
      "threshold": 75,
      "enabled": true,
      "color": "#8B4513",
      "intensity": 5,
      "dutyPercent": 60,
      "cooldown": 10
    },
    {
      "value": "energy",
      "display": "Energy",
      "labels": [
        "Energy",
        "bomb",
        "defuse kit",
        "flash",
        "boost",
        "grenade",
        "utility",
        "smoke wall",
        "nade",
        "electric",
        "neon",
        "power",
        "laser",
        "plasma",
        "spark"
      ],
      "threshold": 75,
      "enabled": true,
      "color": "#00FF00",
      "intensity": 7,
      "dutyPercent": 80,
      "cooldown": 10
    },
    {
      "value": "victory",
      "display": "Victory",
      "labels": [
        "Victory",
        "win",
        "ace",
        "clutch",
        "defuse",
        "plant",
        "round won",
        "rank up",
        "champion",
        "trophy",
        "medal",
        "podium",
        "celebration",
        "fireworks",
        "confetti"
      ],
      "threshold": 75,
      "enabled": true,
      "color": "#FFD700",
      "intensity": 8,
      "dutyPercent": 100,
      "cooldown": 8
    }
  ]
}
